{
  "$schema": "https://json-schema.org/draft/2020-12/schema",
  "$id": "https://geo-vault.local/schemas/admin1.schema.json",
  "title": "Admin Level 1 Region",
  "description": "First-level administrative division (state, province, division, department, etc.)",
  "type": "object",
  "required": [
    "id",
    "name",
    "name_en",
    "local_name",
    "slug",
    "country_code",
    "country_iso3",
    "country_name",
    "admin_level",
    "type",
    "iso_3166_2",
    "adm1_code",
    "postal_code",
    "fips_code",
    "geoname_id",
    "geonames_admin1_code",
    "lat",
    "lon",
    "wikidata_id"
  ],
  "additionalProperties": false,
  "properties": {
    "id": { "type": "string" },
    "name": { "type": "string" },
    "name_en": { "type": "string" },
    "local_name": { "type": "string" },
    "slug": { "type": "string" },
    "country_code": { "type": "string" },
    "country_iso3": { "type": "string" },
    "country_name": { "type": "string" },
    "admin_level": { "type": "string" },
    "type": { "type": "string" },
    "iso_3166_2": { "type": "string" },
    "adm1_code": { "type": "string" },
    "postal_code": { "type": "string" },
    "fips_code": { "type": "string" },
    "geoname_id": { "type": "string" },
    "geonames_admin1_code": { "type": "string" },
    "lat": { "type": "string" },
    "lon": { "type": "string" },
    "wikidata_id": { "type": "string" }
  }
}
