[
  {
    "id": "geonames-12095449",
    "name": "Bagmati Province",
    "name_en": "Bagmati Province",
    "local_name": "Bagmati Province",
    "slug": "bagmati-province",
    "country_code": "NP",
    "country_iso3": "NPL",
    "country_name": "Nepal",
    "admin_level": "admin1",
    "type": "Province",
    "iso_3166_2": "",
    "adm1_code": "3",
    "postal_code": "",
    "fips_code": "",
    "geoname_id": "12095449",
    "geonames_admin1_code": "NP.3",
    "lat": "27.65249",
    "lon": "85.39536",
    "wikidata_id": ""
  },
  {
    "id": "geonames-12095450",
    "name": "Gandaki Pradesh",
    "name_en": "Gandaki Pradesh",
    "local_name": "Gandaki Pradesh",
    "slug": "gandaki-pradesh",
    "country_code": "NP",
    "country_iso3": "NPL",
    "country_name": "Nepal",
    "admin_level": "admin1",
    "type": "Province",
    "iso_3166_2": "",
    "adm1_code": "4",
    "postal_code": "",
    "fips_code": "",
    "geoname_id": "12095450",
    "geonames_admin1_code": "NP.4",
    "lat": "28.38431",
    "lon": "84.03806",
    "wikidata_id": ""
  },
  {
    "id": "geonames-12095452",
    "name": "Karnali Province",
    "name_en": "Karnali Province",
    "local_name": "Karnali Province",
    "slug": "karnali-province",
    "country_code": "NP",
    "country_iso3": "NPL",
    "country_name": "Nepal",
    "admin_level": "admin1",
    "type": "Province",
    "iso_3166_2": "",
    "adm1_code": "6",
    "postal_code": "",
    "fips_code": "",
    "geoname_id": "12095452",
    "geonames_admin1_code": "NP.6",
    "lat": "29.29913",
    "lon": "82.4769",
    "wikidata_id": ""
  },
  {
    "id": "geonames-12095447",
    "name": "Koshi",
    "name_en": "Koshi",
    "local_name": "Koshi",
    "slug": "koshi",
    "country_code": "NP",
    "country_iso3": "NPL",
    "country_name": "Nepal",
    "admin_level": "admin1",
    "type": "Province",
    "iso_3166_2": "",
    "adm1_code": "1",
    "postal_code": "",
    "fips_code": "",
    "geoname_id": "12095447",
    "geonames_admin1_code": "NP.1",
    "lat": "27.23006",
    "lon": "87.18018",
    "wikidata_id": ""
  },
  {
    "id": "geonames-12095451",
    "name": "Lumbini Province",
    "name_en": "Lumbini Province",
    "local_name": "Lumbini Province",
    "slug": "lumbini-province",
    "country_code": "NP",
    "country_iso3": "NPL",
    "country_name": "Nepal",
    "admin_level": "admin1",
    "type": "Province",
    "iso_3166_2": "",
    "adm1_code": "5",
    "postal_code": "",
    "fips_code": "",
    "geoname_id": "12095451",
    "geonames_admin1_code": "NP.5",
    "lat": "28.09952",
    "lon": "82.524",
    "wikidata_id": ""
  },
  {
    "id": "geonames-12095448",
    "name": "Madhesh",
    "name_en": "Madhesh",
    "local_name": "Madhesh",
    "slug": "madhesh",
    "country_code": "NP",
    "country_iso3": "NPL",
    "country_name": "Nepal",
    "admin_level": "admin1",
    "type": "Province",
    "iso_3166_2": "",
    "adm1_code": "2",
    "postal_code": "",
    "fips_code": "",
    "geoname_id": "12095448",
    "geonames_admin1_code": "NP.2",
    "lat": "26.94242",
    "lon": "85.61",
    "wikidata_id": ""
  },
  {
    "id": "geonames-12095453",
    "name": "Sudurpashchim Pradesh",
    "name_en": "Sudurpashchim Pradesh",
    "local_name": "Sudurpashchim Pradesh",
    "slug": "sudurpashchim-pradesh",
    "country_code": "NP",
    "country_iso3": "NPL",
    "country_name": "Nepal",
    "admin_level": "admin1",
    "type": "Province",
    "iso_3166_2": "",
    "adm1_code": "7",
    "postal_code": "",
    "fips_code": "",
    "geoname_id": "12095453",
    "geonames_admin1_code": "NP.7",
    "lat": "29.32055",
    "lon": "80.92063",
    "wikidata_id": ""
  }
]
