[
  {
    "id": "ne-pak-1109",
    "name": "Azad Kashmir",
    "name_en": "Azad Kashmir",
    "local_name": "",
    "slug": "azad-kashmir",
    "country_code": "PK",
    "country_iso3": "PAK",
    "country_name": "Pakistan",
    "admin_level": "admin1",
    "type": "Centrally Administered Area",
    "iso_3166_2": "PK-JK",
    "adm1_code": "PAK-1109",
    "postal_code": "JK",
    "fips_code": "PK06",
    "geoname_id": "1184196",
    "geonames_admin1_code": "PK.06",
    "lat": "33.868",
    "lon": "73.8036",
    "wikidata_id": "Q200130"
  },
  {
    "id": "ne-pak-1108",
    "name": "Baluchistan",
    "name_en": "Balochistan",
    "local_name": "",
    "slug": "baluchistan",
    "country_code": "PK",
    "country_iso3": "PAK",
    "country_name": "Pakistan",
    "admin_level": "admin1",
    "type": "Province",
    "iso_3166_2": "PK-BA",
    "adm1_code": "PAK-1108",
    "postal_code": "BA",
    "fips_code": "PK02",
    "geoname_id": "1183606",
    "geonames_admin1_code": "PK.02",
    "lat": "27.5194",
    "lon": "65.5512",
    "wikidata_id": "Q163239"
  },
  {
    "id": "ne-pak-1112",
    "name": "F.A.T.A.",
    "name_en": "Federally Administered Tribal Areas",
    "local_name": "",
    "slug": "f-a-t-a",
    "country_code": "PK",
    "country_iso3": "PAK",
    "country_name": "Pakistan",
    "admin_level": "admin1",
    "type": "Territory",
    "iso_3166_2": "PK-TA",
    "adm1_code": "PAK-1112",
    "postal_code": "TA",
    "fips_code": "PK01",
    "geoname_id": "1179245",
    "geonames_admin1_code": "PK.01",
    "lat": "32.6148",
    "lon": "69.8985",
    "wikidata_id": "Q208270"
  },
  {
    "id": "ne-pak-1110",
    "name": "F.C.T.",
    "name_en": "Islamabad Capital Territory",
    "local_name": "",
    "slug": "f-c-t",
    "country_code": "PK",
    "country_iso3": "PAK",
    "country_name": "Pakistan",
    "admin_level": "admin1",
    "type": "Capital Territory",
    "iso_3166_2": "PK-IS",
    "adm1_code": "PAK-1110",
    "postal_code": "IS",
    "fips_code": "PK08",
    "geoname_id": "1162015",
    "geonames_admin1_code": "PK.08",
    "lat": "33.7011",
    "lon": "73.0628",
    "wikidata_id": "Q848613"
  },
  {
    "id": "ne-pak-1123",
    "name": "K.P.",
    "name_en": "Khyber Pakhtunkhwa",
    "local_name": "",
    "slug": "k-p",
    "country_code": "PK",
    "country_iso3": "PAK",
    "country_name": "Pakistan",
    "admin_level": "admin1",
    "type": "Province",
    "iso_3166_2": "PK-KP",
    "adm1_code": "PAK-1123",
    "postal_code": "NW",
    "fips_code": "PK03",
    "geoname_id": "1168873",
    "geonames_admin1_code": "PK.03",
    "lat": "34.9407",
    "lon": "72.6402",
    "wikidata_id": "Q183314"
  },
  {
    "id": "ne-pak-1111",
    "name": "Northern Areas",
    "name_en": "Gilgit-Baltistan",
    "local_name": "",
    "slug": "northern-areas",
    "country_code": "PK",
    "country_iso3": "PAK",
    "country_name": "Pakistan",
    "admin_level": "admin1",
    "type": "Centrally Administered Area",
    "iso_3166_2": "PK-GB",
    "adm1_code": "PAK-1111",
    "postal_code": "NA",
    "fips_code": "PK07",
    "geoname_id": "1168878",
    "geonames_admin1_code": "PK.07",
    "lat": "35.7864",
    "lon": "74.9848",
    "wikidata_id": "Q200697"
  },
  {
    "id": "ne-pak-1113",
    "name": "Punjab",
    "name_en": "Punjab",
    "local_name": "",
    "slug": "punjab",
    "country_code": "PK",
    "country_iso3": "PAK",
    "country_name": "Pakistan",
    "admin_level": "admin1",
    "type": "Province",
    "iso_3166_2": "PK-PB",
    "adm1_code": "PAK-1113",
    "postal_code": "PB",
    "fips_code": "PK04",
    "geoname_id": "1167710",
    "geonames_admin1_code": "PK.04",
    "lat": "31.3589",
    "lon": "72.3449",
    "wikidata_id": "Q4478"
  },
  {
    "id": "ne-pak-1114",
    "name": "Sind",
    "name_en": "Sindh",
    "local_name": "",
    "slug": "sind",
    "country_code": "PK",
    "country_iso3": "PAK",
    "country_name": "Pakistan",
    "admin_level": "admin1",
    "type": "Province",
    "iso_3166_2": "PK-SD",
    "adm1_code": "PAK-1114",
    "postal_code": "SD",
    "fips_code": "PK05",
    "geoname_id": "1164807",
    "geonames_admin1_code": "PK.05",
    "lat": "26.3734",
    "lon": "68.8685",
    "wikidata_id": "Q37211"
  }
]
