[
  {
    "id": "geonames-1321850",
    "name": "Ayeyarwady Region",
    "name_en": "Ayeyarwady Region",
    "local_name": "Ayeyarwady Region",
    "slug": "ayeyarwady-region",
    "country_code": "MM",
    "country_iso3": "MMR",
    "country_name": "Myanmar",
    "admin_level": "admin1",
    "type": "State/Region",
    "iso_3166_2": "",
    "adm1_code": "03",
    "postal_code": "",
    "fips_code": "",
    "geoname_id": "1321850",
    "geonames_admin1_code": "MM.03",
    "lat": "17",
    "lon": "95",
    "wikidata_id": ""
  },
  {
    "id": "geonames-1300463",
    "name": "Bago Region",
    "name_en": "Bago Region",
    "local_name": "Bago Region",
    "slug": "bago-region",
    "country_code": "MM",
    "country_iso3": "MMR",
    "country_name": "Myanmar",
    "admin_level": "admin1",
    "type": "State/Region",
    "iso_3166_2": "",
    "adm1_code": "16",
    "postal_code": "",
    "fips_code": "",
    "geoname_id": "1300463",
    "geonames_admin1_code": "MM.16",
    "lat": "18.25",
    "lon": "96.25",
    "wikidata_id": ""
  },
  {
    "id": "geonames-1327132",
    "name": "Chin State",
    "name_en": "Chin State",
    "local_name": "Chin State",
    "slug": "chin-state",
    "country_code": "MM",
    "country_iso3": "MMR",
    "country_name": "Myanmar",
    "admin_level": "admin1",
    "type": "State/Region",
    "iso_3166_2": "",
    "adm1_code": "02",
    "postal_code": "",
    "fips_code": "",
    "geoname_id": "1327132",
    "geonames_admin1_code": "MM.02",
    "lat": "22",
    "lon": "93.5",
    "wikidata_id": ""
  },
  {
    "id": "geonames-1321702",
    "name": "Kachin State",
    "name_en": "Kachin State",
    "local_name": "Kachin State",
    "slug": "kachin-state",
    "country_code": "MM",
    "country_iso3": "MMR",
    "country_name": "Myanmar",
    "admin_level": "admin1",
    "type": "State/Region",
    "iso_3166_2": "",
    "adm1_code": "04",
    "postal_code": "",
    "fips_code": "",
    "geoname_id": "1321702",
    "geonames_admin1_code": "MM.04",
    "lat": "26",
    "lon": "97.5",
    "wikidata_id": ""
  },
  {
    "id": "geonames-1319539",
    "name": "Kayah State",
    "name_en": "Kayah State",
    "local_name": "Kayah State",
    "slug": "kayah-state",
    "country_code": "MM",
    "country_iso3": "MMR",
    "country_name": "Myanmar",
    "admin_level": "admin1",
    "type": "State/Region",
    "iso_3166_2": "",
    "adm1_code": "06",
    "postal_code": "",
    "fips_code": "",
    "geoname_id": "1319539",
    "geonames_admin1_code": "MM.06",
    "lat": "19.25",
    "lon": "97.5",
    "wikidata_id": ""
  },
  {
    "id": "geonames-1320233",
    "name": "Kayin State",
    "name_en": "Kayin State",
    "local_name": "Kayin State",
    "slug": "kayin-state",
    "country_code": "MM",
    "country_iso3": "MMR",
    "country_name": "Myanmar",
    "admin_level": "admin1",
    "type": "State/Region",
    "iso_3166_2": "",
    "adm1_code": "05",
    "postal_code": "",
    "fips_code": "",
    "geoname_id": "1320233",
    "geonames_admin1_code": "MM.05",
    "lat": "17.5",
    "lon": "97.75",
    "wikidata_id": ""
  },
  {
    "id": "geonames-1312604",
    "name": "Magway Region",
    "name_en": "Magway Region",
    "local_name": "Magway Region",
    "slug": "magway-region",
    "country_code": "MM",
    "country_iso3": "MMR",
    "country_name": "Myanmar",
    "admin_level": "admin1",
    "type": "State/Region",
    "iso_3166_2": "",
    "adm1_code": "15",
    "postal_code": "",
    "fips_code": "",
    "geoname_id": "1312604",
    "geonames_admin1_code": "MM.15",
    "lat": "20.5",
    "lon": "94.75",
    "wikidata_id": ""
  },
  {
    "id": "geonames-1311871",
    "name": "Mandalay Region",
    "name_en": "Mandalay Region",
    "local_name": "Mandalay Region",
    "slug": "mandalay-region",
    "country_code": "MM",
    "country_iso3": "MMR",
    "country_name": "Myanmar",
    "admin_level": "admin1",
    "type": "State/Region",
    "iso_3166_2": "",
    "adm1_code": "08",
    "postal_code": "",
    "fips_code": "",
    "geoname_id": "1311871",
    "geonames_admin1_code": "MM.08",
    "lat": "21",
    "lon": "96",
    "wikidata_id": ""
  },
  {
    "id": "geonames-1308528",
    "name": "Mon State",
    "name_en": "Mon State",
    "local_name": "Mon State",
    "slug": "mon-state",
    "country_code": "MM",
    "country_iso3": "MMR",
    "country_name": "Myanmar",
    "admin_level": "admin1",
    "type": "State/Region",
    "iso_3166_2": "",
    "adm1_code": "13",
    "postal_code": "",
    "fips_code": "",
    "geoname_id": "1308528",
    "geonames_admin1_code": "MM.13",
    "lat": "16.25",
    "lon": "97.75",
    "wikidata_id": ""
  },
  {
    "id": "geonames-8239588",
    "name": "Nay Pyi Taw",
    "name_en": "Nay Pyi Taw",
    "local_name": "Nay Pyi Taw",
    "slug": "nay-pyi-taw",
    "country_code": "MM",
    "country_iso3": "MMR",
    "country_name": "Myanmar",
    "admin_level": "admin1",
    "type": "State/Region",
    "iso_3166_2": "",
    "adm1_code": "18",
    "postal_code": "",
    "fips_code": "",
    "geoname_id": "8239588",
    "geonames_admin1_code": "MM.18",
    "lat": "19.8822",
    "lon": "96.14182",
    "wikidata_id": ""
  },
  {
    "id": "geonames-1298852",
    "name": "Rakhine State",
    "name_en": "Rakhine State",
    "local_name": "Rakhine State",
    "slug": "rakhine-state",
    "country_code": "MM",
    "country_iso3": "MMR",
    "country_name": "Myanmar",
    "admin_level": "admin1",
    "type": "State/Region",
    "iso_3166_2": "",
    "adm1_code": "01",
    "postal_code": "",
    "fips_code": "",
    "geoname_id": "1298852",
    "geonames_admin1_code": "MM.01",
    "lat": "19",
    "lon": "94.25",
    "wikidata_id": ""
  },
  {
    "id": "geonames-1298480",
    "name": "Sagaing Region",
    "name_en": "Sagaing Region",
    "local_name": "Sagaing Region",
    "slug": "sagaing-region",
    "country_code": "MM",
    "country_iso3": "MMR",
    "country_name": "Myanmar",
    "admin_level": "admin1",
    "type": "State/Region",
    "iso_3166_2": "",
    "adm1_code": "10",
    "postal_code": "",
    "fips_code": "",
    "geoname_id": "1298480",
    "geonames_admin1_code": "MM.10",
    "lat": "23.5",
    "lon": "95.5",
    "wikidata_id": ""
  },
  {
    "id": "geonames-1297099",
    "name": "Shan State",
    "name_en": "Shan State",
    "local_name": "Shan State",
    "slug": "shan-state",
    "country_code": "MM",
    "country_iso3": "MMR",
    "country_name": "Myanmar",
    "admin_level": "admin1",
    "type": "State/Region",
    "iso_3166_2": "",
    "adm1_code": "11",
    "postal_code": "",
    "fips_code": "",
    "geoname_id": "1297099",
    "geonames_admin1_code": "MM.11",
    "lat": "22",
    "lon": "98",
    "wikidata_id": ""
  },
  {
    "id": "geonames-1293118",
    "name": "Tanintharyi Region",
    "name_en": "Tanintharyi Region",
    "local_name": "Tanintharyi Region",
    "slug": "tanintharyi-region",
    "country_code": "MM",
    "country_iso3": "MMR",
    "country_name": "Myanmar",
    "admin_level": "admin1",
    "type": "State/Region",
    "iso_3166_2": "",
    "adm1_code": "12",
    "postal_code": "",
    "fips_code": "",
    "geoname_id": "1293118",
    "geonames_admin1_code": "MM.12",
    "lat": "13",
    "lon": "99",
    "wikidata_id": ""
  },
  {
    "id": "geonames-1298822",
    "name": "Yangon Region",
    "name_en": "Yangon Region",
    "local_name": "Yangon Region",
    "slug": "yangon-region",
    "country_code": "MM",
    "country_iso3": "MMR",
    "country_name": "Myanmar",
    "admin_level": "admin1",
    "type": "State/Region",
    "iso_3166_2": "",
    "adm1_code": "17",
    "postal_code": "",
    "fips_code": "",
    "geoname_id": "1298822",
    "geonames_admin1_code": "MM.17",
    "lat": "17",
    "lon": "96.16667",
    "wikidata_id": ""
  }
]
